{
  "system": {
    "name": "multi-model-review-agent-before",
    "description": "A primary agent forwards retrieved content to a review model and trusts an LLM judge."
  },
  "threat_context": {
    "cia_impacts": [
      "confidentiality",
      "integrity"
    ],
    "attack_paths": [
      "indirect",
      "multi_model"
    ],
    "external_references": [
      {
        "namespace": "hiddenlayer-ape",
        "version": "2026-06-18",
        "source_url": "https://github.com/hiddenlayerai/ape-taxonomy",
        "ids": [
          "HLT07.04",
          "HLT08.01",
          "HLT08.02"
        ]
      }
    ]
  },
  "data_objects": [
    {
      "id": "retrieved-document",
      "format": "json",
      "structural_isolation": true,
      "structural_isolation_evidence": "retrieval-envelope-test-1",
      "fields": [
        {
          "name": "document_id",
          "trust": "trusted",
          "origin": "retrieval gateway",
          "security_role": "identifier"
        },
        {
          "name": "body",
          "trust": "untrusted",
          "origin": "external retrieval corpus",
          "security_role": "content"
        }
      ]
    }
  ],
  "actions": [
    {
      "id": "publish-review",
      "impact": "high",
      "verification": {
        "type": "llm_judge",
        "verifier": "shared-context-judge",
        "independent": false
      },
      "parameters": [
        {
          "name": "document_id",
          "source": {
            "object": "retrieved-document",
            "field": "document_id"
          },
          "deterministic_validation": true,
          "validation_evidence": "document-id-schema-test-2",
          "provenance_check": true,
          "provenance_evidence": "retrieval-gateway-signature-test-3"
        }
      ]
    }
  ],
  "outputs": [
    {
      "id": "review-context",
      "source_fields": [
        {
          "object": "retrieved-document",
          "field": "body"
        }
      ],
      "consumer": {
        "type": "llm",
        "id": "review-model"
      },
      "sink_type": "forward_to_model",
      "impact": "high",
      "provenance_preserved": false,
      "deterministic_validation": false,
      "independent_verification": false
    }
  ],
  "mitigations": [
    {
      "id": "M-judge",
      "control": "LLM judge review",
      "scope": "actions.publish-review",
      "effect": "detect",
      "owner": "agent-platform",
      "verification_status": "planned"
    }
  ]
}
